text,sentiment
all done no more internship,neutral
rip to officer edwards may god continue to bless his family whats up wit cops killing cops seen the same thing happen on the wire,neutral
invasion of the old ladies has just ended still have to clean up not going to be able to make it to the tweetup tonight,neutral
s current goal is to lose 10 pounds by next tuesday 120 here i come   soooo ready for gatlinburg,positive
my best friends bought something which i really want,positive
 it depends on your goals  how much you want to spend  cannondale specialized and cervelo are all good brands,positive
on the phone to mum  httptinyurlcomotdn9u,neutral
 me tooo,neutral
my net died so yeah  im sad now,negative
 then am anticipating the next ten days,neutral
i dont know why i follow sme of the ppl that i do they e anoying and boring  note to self unfollow peeps on monday morning,negative
 yeah when you start reaching your earlymid20s,neutral
getting ready to babysit,neutral
bad migrane and need to go to dancing tonight not a good combination,negative
grinding skyguard rep this is less awful than i anticipated yet still awful last tabard i need,negative
 i dunno if he saw it  happy birthday girl,positive
 im looking forward too see and hear you in norway live fast,neutral
 awesome,positive
 actually workin from home tonight  you,neutral
  i want to be at the beach in the sun,negative
oh i am just so tired,negative
well my dog still isnt at the shelter i hope someone good has him,positive
 well tell me what fashion tips you need and im your woman  hehehe,positive
 hello there taylor  i miss you its been 2 months 3,negative
i wear a lot of white  httptinyurlcomdlbltg,negative
 always a good idea,positive
  i remember those days i wasnt a big fan of wesley but i really felt for you as a youngster dealing with all that but you won,neutral
getting nails done how relaxing benji is only 24 hours away,positive
 not here for long hun head hurts,negative
at walmart playing hide and seek,neutral
 whatever do you mean,neutral
all of a sudden im craving broccoli and cheese soup really bad my mouth is watering envisioning a bread bowl in my head,negative
 that it does  just wish more people would notice it,positive
 your test works fine for me  tweetdeck is so cool eh,neutral
wish you were here babe,positive
this morning i rode behind a guy with a bird cage containing a plastic tyrannosaurus rex attached to his bicycle i couldnt get a photo,negative
i love summer but i oddly dont want this school year to end,positive
 lolz at your modestykix roxnow all the gals will be lined up at your door,positive
morning how is everone sing to me  you tuck me in turn out the light kept me safe and sound at night 8,positive
i so cant be bothered working tomorrow,positive
 kittens are cute then they grow up n become cats,positive
  guess ol tom has another mission impossible  some of this is like trying to prove innocence  i didnt get hugged,negative
 hey i was scared last night at 317 because of you and i had several bad nightmares,negative
 gawd people still remember the preggers comment hate you,negative
oh no my tweetdeck is malfunctioning o il have web will its fixd,negative
 heeeeey you abandoned me here on twitter momma dots,neutral
 yeah freakin sucks,negative
off the a village may fayre now  bag packed ready to bring back homemade goodies,neutral
followfriday _1001 cuz ive never been added to anyones followfriday either   cuz hes got a cool picture,positive
sooo tell me how i lost followerzzz,neutral
  thanks for the reply of course it doesnt really explain it  i googled it but found no explanation,neutral
looking for people,neutral
wishes that you would see not with your eyes but with your heart  httpplurkcompsv5bb,positive
 awwww   ive got some photos of cute bunnies,positive
long day and i still have to mow the lawn,negative
shoot only 12 miles,neutral
 why has it been so long since i have talked to you let alone seen you it makes me sad,negative
happy mothers day mom  ,positive
i want cookies for breakfast luckily im an adult and can do that,positive
mowing 6 i hate my lawn,negative
 you shouldnt have to reset more than once  if it doesnt work right the first time something is up,neutral
 yeah i left cause my pc cant run the client anymore i had thought i would have a new one by now,negative
feeling bad for  profile pic,negative
capones island in 2 days my summer is just starting,neutral
movie then sleep today was good day  hd3ff,positive
planing on going on a little ride on the mtb on monday  may be in over to the tower,neutral
 fiesta at my house in my mouth  hit me up for the password,neutral
the live version is so much better   httpblipfm79my3,neutral
 theres no pause button in the game of life,neutral
 thats black market material right there my friend,neutral
is getting married in vegas in november by an elvis impersonator am so happy,positive
 tried to join the chat but the site would not let me sign in,negative
 where is home,neutral
singing songs and filming movies  what i do best,positive
their songs make me want to cry,negative
while driving u come across aggressive driving behaviour by another driver u should chase the car 2 tell the driver how to drive,negative
the mediteranian kitchenoh well cant get them all right,neutral
 whats wrong,neutral
 wasn totally awesome  seeing the rebooted crew was so nice,positive
_d thats good to know and i bet he looks just like you,positive
_43 hahhahah that really made me laugh out loudd ahahahahahahahahah your fuunny,positive
i so wish i could get pregnant,positive
 im trying to fix it it doesnt do it  and its ahi dios mio but u did good lol,positive
 hiya missed you too what have you been up to,negative
out to play,neutral
really sick,negative
yay  my only on sundays maid came the house will be clean again,neutral
thx robban  httpwwwskgamingcommatch17905,positive
 thanks jk  love ya to death,positive
going to al ain  need to check out one store hope i find things that im looking for,positive
geeze im just wondering what is wrong with some people i either need to go for a run or go to sleep tomorrow should be a fun day,neutral
so my parents are too busy making me feel like  to realise that ive got worse and need to see a doctor again no sleep sucks,negative
 gnight jonathan i tried to stay up i really did i cant wait till ur in my timezone will be so much easier then,positive
prom is so over rated irritated going to bed goodnight,negative
look everyone im a bad boy im ranked higher than meghan mccain  httptinyurlcomoj76mz,neutral
_rain i wanna see her hair  hows everyone,neutral
 or ftrh  for the ride home,neutral
 english screwed up my overall percentage in x in xii again and probably in adm tests too  happens,negative
 i want chinese food really baaad,positive
is downloading songs  httpplurkcomprp8wx,neutral
 i almost said and grammer no exist either grunt  but i stopped myself,neutral
_d youre gonna take good care of that little baby and hes gonna be a strong boy thats for sure,positive
 ha lemme know what you find tho i suspect it will be a lot of complaints have a peaceful night my friend,positive
seeing shane dawson videos,neutral
  sad face,negative
aaaaahhhh friday but     funeral at 5,negative
already misses ,negative
_laura_lp ok thanks for the help i hope they respond to me sooner or later then thanks,positive
  out of commish for a few days in atl with fam  just saw the updates to the net website looks awesome,positive
 awww that sucks  also when i finish uni you should totally have a mini housewarming yes work it around my schedule lol,negative
at famous daves with my mom so hungry,neutral
 i would vote for you miley but i live in ireland  youll be fine  good luck slãââ½nbye in irish  sorcha xxxx,positive
home for the nite sleeping on the pull out bed with maggie wishing it was _durden  i got to find a apt,neutral
ohsummer beginsyay  the fighting crying and stress has started with the kidsits only been 3 hrs since they got out,negative
i feel so deflated no more doggy,negative
 sad about young love coming to an end  they were sooo cute together,neutral
 omg really  i sowwy ill do it again p i was tired when i did that this morning p lol,negative
owww back pain  hm walmart or no i could get cupcakes,negative
 i cant believe that you guys are gonna stay just one day here in rio de janeiro again,neutral
making my boyfriend look different  hes  cute no matter what 3,positive
 lol thx,positive
is working until 11 tonight  httpplurkcompx2kbv,neutral
 well there go my peace corps prospects,positive
rmbr the time when we torned for the night in sentosa i was the only one who didnt have to spit out the  3 unknown facts abt myself,neutral
 good idea ill have to remove all the old receipts tissue paper and other nonsense before i can take a pic,positive
whatever will be will be,neutral
wango tango good night all,neutral
 im not in the best financial situation myself at the moment im beyond broke my money is spend as soon as i earn it atm,negative
 hello you  you should totally go to the biggest shopping center in europe and we can go shopping together   ,neutral
fixing openbox theme a little,neutral
selling my laptop for cheap if anyones interested  17 toshiba 13gig ram,neutral
if recent experience is anything to go by i fear i might be going off indian food this is not good people not good,negative
 i wish i wasnt all  bummed but i kinda am,positive
 hey mitchel when will you be live again i didnt get a chance to call you,negative
looking at the sunshine out of my office window,neutral
back is sore should not have done that jump last night,negative
 we are working,neutral
brides a la mode pow wow first thing this morning   this past weekends lovely wedding fresh in my mind pics soon,positive
just got my paycheck april bonus can b deposited 2day the rest gotta wait til mon,neutral
nope no way in to stop  just have to put up wiv it,neutral
i recommend returning your broken duck toy with the batteis it came with or the person who your giving it to may get mad  trust me,neutral
 not so much a substitute as a variation ate too much too oof,neutral
such beautiful weather why are u sick baby    tanapolis,positive
 oui mademoiselle you can barely turn around these days without bumping into one,neutral
flickr pics chester zoo danwtmoon posted a photo   welcome to chester zoo by jockey  httptinyurlcomcq7qw8,neutral
woke up and watched jon and kate plus eight i tried to pretend like they were still a normail family,neutral
 youre a freak,neutral
 i dont even know now lenaaa  when you going clothes show,neutral
_jane yay buti nagustuhan nyo isang bar lang enclosed ko sa mail  to test if matutunaw or hindi next time uli,neutral
memories,neutral
 yep nothing to worry about,positive
back to work tomorrow  whose idea was it to go back on a saturday oh wait that would be mine fail,negative
 going to start very small like 010 or 050  then slowly to higher stakes,neutral
 make a videoblog,neutral
reading evermore by lynn viehl,neutral
wow what a storm we just had now no power,positive
getting my phone back this week  yeeeewww,positive
back from school  daily show was amazing  gonna watch it again later i think xd,positive
_breez yer please do have a good day,positive
musicmonday epic song y   lights and sounds by yellowcard  httptinyurlcomdb7ppm,neutral
 hot cuppa coffee made with milk  fortified with monins irish coffee syrup bliss,positive
right im out of here peeps i hope  fixes twitter mobile so i can tweet from the race mtwitter has been down for 4 days  fail,positive
my anticipated meet up with tapan parikh is no more  apparently he wont pass by nairobi and will head straight from mombasa,neutral
watching army wives and it always makes me cry,negative
productive day 1,positive
rest in peace  adam 12  glenn epps gone but never forgotten what a week loud in da air 4 ya,neutral
 gotta love the summer,positive
marking going ok so far as and bs so far  relieved it looks like i have future programmers in class,neutral
 alas no its just a normal night  monday is quiz night,neutral
did anyone go photographing today i managed to get a few macro shots of some flowers that were blooming,neutral
_buckley good morning from sunny londonsounds like an oxymoron but happens to be true of today  hurrah,positive
 cool thatd be fantastic,positive
live on stickamcomitstyleryo come chat,neutral
   but  is right this is like the cape breton coal mines but  no lessons learned,neutral
 yes but im quite rusty  im hoping to get back to it and tune up my skills  tim plays guitar  we threaten duets,negative
hey everybody  hah this day is cool just got back from walk with the dog  omgosh send me the link again please,positive
 srry im not so interesting right now stayed up til 6am cause my tummy hurt and now im pooped and have to work,negative
 me because i might not have enough money for college,negative
lol woow okay its not that big of a deal,neutral
i love how when i leave my laptop on my bed it creates a nice toasty spot,positive
 i mean someone hit a dog with a car it was just laying there,neutral
 does it start tomorrow  i was going to book sam on that and forgot,negative
 salt and vinegar cheese and onion make your breathe smell lol  ,negative
 youre welcome there  i added you already,positive
_rose mornin   missed dance time so i guess i will have to dance extra hard tomorrow,neutral
 sorry to hear about your dude probs what is it thats too much,negative
discovered that numpy arrays can hold values of any type  useful for manipulating arrays of numbers with uncertainties,negative
maybe i should take up drinking again feel as if i have a massive hangover  still not yself today,negative
just downloaded the tweet decklook at my and my saviness,neutral
today friday i really hope you will read my messages here and reply to me soon i could not reach you by phone before you go to work,positive
 whatever i know you like it  hahahhah,positive
oh no my fun weekend with friends is gone my mother has made a family weekend of it  ,negative
good morning twitterland happy monday,positive
writing reports,neutral
thanks timmy  turns out he has strep and a high fever,positive
 oh that is very nice i will do something nice next week  going to madrid next weekend for few days,positive
keeping it chilled,positive
what a beautiful day not to got to my first class,positive
 fabulous and i didnt get that pic  gmail be acting the fool sometimes can u dm me it,positive
 yeah its terrible  cockatoos are the hardest to live with so emotional good thing he found you though,neutral
_ that sucks,negative
 yes it does,positive
_datti thanks sankar for ur wishes,positive
i love waking up and thinking its a weekday but then realizing its the weekend,positive
 sorry bout the cat,negative
 youre the only person to have joined in  penilewords,neutral
up and washed  im clothing myself as i type xd woooo,positive
 miss u too im still at a clubu knowwest coast ,negative
 love love love pot psycology my friday night treat,positive
happy star wars day  may the fourth be with you,positive
 playing with lighters fire matches and grass,neutral
_art that would be the one  its awesome sauce,positive
bucky my ferret officially has insulinoma  now on daily prednisone had interview with pdoc today have to go back monday for testing,neutral
 ive never been to prague but if i had the money itll be in the 10 first cities i visit,positive
coffee time,neutral
 he was creepy for me at first but i did really grow to like him i cried like a baby when he and tosh died,neutral
_ really that son of a  screw him ill talk to on msn later k  xox,negative
 we didntbut we did have to wait a good twenty minutes for one  good night though,positive
 i always hope they will die out but then i see the the old ones and it makes me sad,negative
 thanks alen it seems that we can only submit community news is this an error or must we prove ourselves,neutral
 dont follow me you will ruin my twitter experience,negative
blah to car repairs almost 600 dollars   shopping around for a better deal,negative
weetabix and choco milk  yum,positive
 me too,neutral
im sad to have lost another person close to me to cancer,negative
_me thanks kinda bittersweet though,neutral
_nutbar good morning  how are you twittertakeover,positive
first time to twitter,neutral
captain jack is back,neutral
_la bens dreams make me so saddddddd  i want them to be togetherrr i swear if this  gets me bawlinggg so help me,negative
internet you were so fast and now you are so slow where did the fast connection go,neutral
 6 am  you,neutral
30 year old barbie dolls still can rock itthat girl was hot  and ken aint so bad either  now those are memories,negative
this weather makes my fingers numb  still waiting,negative
 lol yeah ima mama  thanks happy mamas day and lakers day i love it,positive
doneits summer,neutral
 i was just at genos 3hrs ago  would have went to pats but the neon lights got me lol  had drinks at south philly bar too,neutral
httpyfrogcom0xoxij fry bread is good but they only gave me a little pinch of lettuce  ha ha,positive
 its wow effect  thanks for the update,positive
got up at 8 today and also misses his friend ,negative
catching up on my reading twitter n bf break,neutral
 no thats not right  i remember now  you were in a fearless tweet  we were both seen as fearless,neutral
  my thoughts dwell on a certain person,neutral
transition time is over tonight i work night shift i woke up at 1330,neutral
gonna go to work with my honey today so exciting,positive
_ aww thats too bad you lost it though,negative
 this my new more private acc will only use it for close twitter friends,neutral
i hate going online and looking at the balance in the bank  its always a lot lower than i need it to be,negative
 actually the web works fine tweetdeck seems to be the culprit  sadness its done this at two diff locations,neutral
_x how did your geo isu go i swear i just had the worse day ever,negative
and you could have it all my empire of dirt im in ae with dad im freezing fully shivering every1 else is warm  no fones allowed ffs,negative
 tell me what you think of pride prejudice and zombies    if youre not all hyped up on sugar,neutral
_tdh can you install ruby gems and rails on keep please,neutral
out for ultimate training looking forward to the sunset,positive
going to work once again what a great few days off i had now its over  but atleast i get 2 more commin up wahooooooo,positive
 good to see you back sorry that happened to you,neutral
my 1st mothers day tomorrow,neutral
you said darling what happened did i fall asleep and you carry me home cuz i know i wasnt here goodnight twitterererers,positive
 i just about clear my whole office and no sign of it  next place is truck i have yet to fully clean under back seat lol,neutral
 its not gonna storm  because i said so,neutral
 i broke my ipod,negative
_banks something must be wrong only found 17 july harlsil books i wanted,negative
 haha and you should state pride is important,positive
 ugh did you just say your friend might have swine flu omg why,negative
 haha no problem its fun isn,positive
finally got to wash my hair i feel much better now but i gotta dry it  effffffort,positive
finally feel back into swing of things here at work after getting married last week sigh of relief for no more wedding planning,positive
 that sucks  booo,negative
hates untalented  being mean to my talented friends,neutral
looks like were rained out for weekend climbing,negative
is google maps not working for anyone else,neutral
 oh ,negative
 i dont really trust the judgements and vouches of _xo   jk ill think about becoming a friend of yours,negative
 jesus heals,positive
 its surprising how much billy idol turns up in tweets i monitor constantly  not that im obsessed or anything  billyidol,neutral
 werd thats very true,neutral
 your birthday well happy birthday,positive
without wings again,neutral
 did you tweet me i thought i remembered seeing one but i cant see it now so glad teatree is ok,positive
night twitterland x i have to be up in five hours  sigh,neutral
 happy birthday in 2 hours and 54 minuets  haha,positive
lunch breaks over going back to work,neutral
glad to see its a typical bank holiday weather wise  i was going to do so much today  yeah right,positive
 hayley williams is pretty much amazzing,positive
 the app said i need 1215 or later,neutral
 nothing,neutral
is in php website upgrade hell on a bank holiday hows that for planning,neutral
 not really having a good night missing my little girl,negative
  miss you captain,negative
im sending this to my mother  httpbitly1aa1rf,neutral
 oi are you mocking the fact i dont cry at tv things  feels badxxx,negative
 i am public and cant get anyone to follow me,neutral
 until  brings back our everyone button access pt  httptwittercompublic_timeline or link in bottom of settings,neutral
 boring who you been talking to lol not me   no ,neutral
  i know right i guess the oldest doesnt hold rank on field trips anymore,neutral
just signed upso hello twitter world here i am,neutral
 i wont be getting any rotf toys till much later  tell me if anybody isntis worth getting,neutral
 heading over to xbox  will go shopping 2morrow,neutral
 i saw that you were calling but cannot answer as im in the second hour of a phone convo with my mom and she wont stop talking,neutral
is excited  httpplurkcompstk04,positive
 hmmm really thats weird idk about that one  sowwy,negative
 oh that looks boring  and even more boring you have an exam on a saturday,negative
practice was a beast today not going to see julian tonight,neutral
getting somewhere with my first real kiokudb and catalyst app yay,neutral
 thanks though  am trying to be positive  wine may not be helping lol  wish i could make the gigs,positive
 i think my niece got me sickee  lame,negative
rise and shine  time to get prettifide,positive
 i tried sooooo hard to work from home today but failed  not my fault though,negative
 gosh ive a stinky old headache maybe i should have lunchfast,negative
glenna is bored but glad that it is a beautiful day macy went swimming and kris played golf while i sat at home waiting for them,neutral
bout 2 have 1 more drink then imma head in da house,neutral
i get so sucked in to true life and that steveo documentary was intense i love that  its nice to see people get their lives back,neutral
i love my life  ni night twitter3,positive
 we knew what what you meant,neutral
succesfully following tayla,positive
my new phrase is you never doubt mo williams   six game win streak,neutral
 have fun tomorrow night i think it will be more fun at a bar than art gallery wish i could be there,positive
 4th please not maybe shell get 3 attempts and win tomorrow,neutral
trying to learn to tweet  its all good i hope,positive
bleargh i can never clean as much of my house as i want to before work no matter how early i wake up today sink laundry,negative
great social network sites are still growing,positive
 if i got paid by the hour i could retire by now  do you have xbox live i am thinking rock band,neutral
i should learn not to walk all day and then sprint through sprinklers without stretching,neutral
 soi was half asleep when i wrote the previous message greatest friends haha  you are,positive
 im still trying to see star trek ill just have to woman up and go alone bf is pretty much worthless anyway  lol,neutral
  laws change in the 70s or 80s   i could really push it bcause gran from bathgate but she was us citizen b4 dad born,neutral
some of my new followers are pretty cool tweeps check em out,positive
no work today went shopping and now relaxing  learning for the toefl,positive
is off to watch arsenal v chelsea today,neutral
hes getting ear tubes in about an hour so no food,neutral
 yay asap lol awwh i miss our friday night happy hours even luna del sea and the boy hahahaha,negative
left the bases loaded,neutral
 cowboy westernshavent seen those in a while good luck,positive
 its already over ,negative
 i was trying to back all her documents up but it wasnt playing along its taking forever but am back at it again now,neutral
doing some test shooting later this afternoon  did i mention being in holland for an indie wine festival this week my tongue is red,neutral
my dad knows i got drunk today and i didnt get in trouble,positive
 so ill excuse your love for the cavs and the west even though i dont share it,neutral
 lol  i could try  seriously tho dont do all of it that sucks ,negative
  i wanna see the rest i only saw like 30 minutes,negative
happy mothers day mom  i love you,positive
burning cds  outa blank discs,positive
 new album is truly genius so happy with it,positive
 youre alive  go w the notebookitll make you cry and stuff,negative
 okaii cool  i cant wait for the series to begin its guna be awesome  x,positive
crying to a walk to remember as usual,negative
i only hav 8 followers                 ,neutral
happy star wars day everyone  off to celebrate with the family ok were not celebrating it but i am going round to the famos,positive
i also have a certain cd from camp that a certain somebody gave me  yeah theres this guy in the video thats really frickin hot,positive
its mothers day,neutral
yay for birthdays  sadly my voice is almost gone  but it was a pretty good night,neutral
we finally hit 1000 friends thanks,positive
 im part of a religion called peoplewithgoodtasteinmusic we dont celebrate jonas brothers day,neutral
im at workbored out of my mind,negative
watching the notebook,neutral
