text,sentiment
last session of the day  httptwitpiccom67ezh,neutral
 shanghai is also really exciting precisely  skyscrapers galore good tweeps in china  sh  bj,positive
recession hit veronique branquinho she has to quit her company such a shame,negative
 happy bday,positive
 httptwitpiccom4w75p  i like it,positive
 thats great weee visitors,positive
i think everyone hates me on here   lol,negative
 soooooo wish i could but im in school and myspace is completely blocked,negative
 and within a short time of the last clue all of them,neutral
 what did you get  my day is alright havent done anything yet leaving soon to my stepsister though,neutral
my bike was put on holdshould have known that argh total bummer,negative
 i checked  we didnt win,neutral
  and youre on twitter did the tavern bore you that much,neutral
im in va for the weekend my youngest son turns 2 tomorrowit makes me kinda sad he is getting so big check out my twipics,negative
its coming out the socket  i feel like my phones hole is not a virgin thats how loose it is ,negative
so hot today _  dont like it and i hate my new timetable having such a bad week,negative
 miss you,negative
cramps   ,negative
 you guys didnt say hi or answer my questions yesterday  but nice songs,positive
im going into a spiritual stagnentation its exploding my ego i now realise im not all that great and im ok with that,neutral
stupid storm no river for us tonight,negative
my dead grandpa pays more attention to me than you do,negative
 need retail therapy bad ahhhgimme money geebus,negative
about to go to sleep,neutral
 you are lame  go make me breakfast,negative
 thats so cool,positive
hey peoples dont you just hate being grounded haha im just sat eating an apple and watching death note some anime,neutral
huh another scarepoint coding sunday,neutral
 look who i found just for you    httptwittercomdjt2009,positive
no ac the fan doesnt swing our way  we are sweating it out on a hot humid day,negative
 guess that depends on if you want to be on the jury,neutral
resorted to eating mickey ds alone,neutral
there is a faux gothy chick looking at me sorry i am not going to camden and i like poppunk and jimmy eat world,neutral
 did he ask for your twitter id your sun sign,neutral
 whered you go,neutral
watching body of liesgood film,positive
happy mothers day mumm  xoxo,positive
so i really need to put the laptop down  start getting ready for  shindigbut ive missed my twitterloves all day,neutral
 im sorry  at least its friday,negative
feels sorry every time im printing out i use like 200 new papers,negative
 4n ma rog  never heard of it  esti beat acum u tweet too much,negative
 i always forget something when i travel i am at newark airport,neutral
should have left car and walked home i might need someone to rescue me with petrol light flashing,neutral
im only updating this so that bretts phone beeps  but really looking at wedding stuff againfor the next five months,neutral
 hi there  i agree  small children should be running about happy not breaking down in tears,positive
  hope ur havin fun in da club,positive
i miss my old phone it worked so good until i dropped it  i want a new one for my birthday,neutral
thinks sg is wonderful,positive
  im really sorry i know wallah how u feel this life is shittttttttt,negative
not happy,negative
is watching acoustic performances  in the mood for a good friends episode i miss that show,neutral
 ill oscillate from one to the other,neutral
im so very tiredand have insomnia,negative
 thanks ennio,positive
 you should totally come get me and bring me to kelslaws house with you,neutral
 you seem nice youre generous and you know your stuff,positive
 u so dirrrrrty why oh why did i pick the hawks  i figured i needed a longshot and they were a better bet than car,neutral
almost got a kitty yesterdaybut it didnt work out,neutral
reality needs to check in schools over time to party  not tonight tho im going to bed night night,neutral
   caladesi was definitely a nice peaceful way to spend a sunday i got a lil tan,positive
 i still dont know what we would do though,neutral
_xo   dang it so its not certain    are you okay,neutral
change of plans i am staying in brandon  no papaya salad for me,neutral
dear rain you suck now i gotta change my plans for tonight,negative
at starbucks with my love eff school i have work later too,neutral
i just cried whilst watching hollyoaks   i need a life lol,negative
hi all just recovering from a party looking forward to an exciting bank holiday around the diy shopslife cant get much bettersurely,positive
terminator salvation by myself,neutral
 fortheloss dumbface  him not u what u up to on the wknd i wanna seeeeeee ya,negative
 why do i have to enter my registration details every time i update,neutral
on the monday so i wont be able to be with you  i love you,positive
 ur so cuteim a fan of dream a little dream this kiss and appearances like in dawsons creek  make more flicks,positive
 tgif is righti think i broke my toe last night  on my bad foot,neutral
 oherr its soon then do you have plans i had a party on saturday  x,neutral
_lamont yr very young looking dude,positive
 hmmm wrong link ignore my tweet,negative
att cheated the system and now i have no green day tickets   you att,negative
tracy and berwick breaks my achy breaky heart  they split ways in the hallways,negative
 yep i wish they were all playing dubiln,positive
 im a lady and ladies dont move couches they direct where the couches go,neutral
 yay for block party  youre the bomb blockheads 3 dave   thanks for supporting nkotb,positive
 26th february,neutral
guess what mom adopted a kitty today 11 months his name is corky,neutral
happy birthday snickers  i hope you have the best day ever lets go shopping,positive
 thank you  im working on s,positive
 lol man i got 2 1 2 hrs an iont how i woulda made it wit out my ramen noodles and tv time,neutral
not feeling all that well today,negative
httptwitpiccom4wp8s  my ear hurts and this is my medicine gum,negative
_berland lmao i know i know,neutral
gnight shar    vega ,neutral
the underwire in my bra is sticking out and poking me in the armpit,negative
happy mothers day,positive
yes i am,neutral
 i cant call mitch  im from sweden,neutral
happy star wars day may the fourth be with you,positive
was so excited to eat the wartermelon i bought the other day and it was terrible and not sweet,neutral
i just watched marley  mei cried so hard,negative
take antibacterial to school to clean your hands when you cant go the loos,neutral
im leaving work now trying to decide if i return on sunday afternoon or monday 4 am to meet a noon uk time deadline,neutral
 haaawwell i get out of class at 1050i hope i make it,positive
oooh sunshine a patch of sunshine and it will be gone by the time i leave work and replaced with rain  vent,neutral
skype call with billie but my webcam dont work,neutral
just had a great study time followed by a delicious japanese meal with arty now trying to get back into the study mood,positive
fml not having a car is prohibiting finding a job,negative
  lol since i got twitter a little while ago it seems like loads of people setting up an account,neutral
 i want to see david cook,positive
 yeh me 2,neutral
 learning tat the scenic way  din plan to go town but somehow was herded there,neutral
 i dont want to do anything specific i just want to see you and puppy,neutral
 yeah i need his fricken cell number ive tried his home for months and hes too busy i miss braddddddddd,negative
toy story 3 trailer premiered with up i need my computer back,neutral
ughh on the phone with hp,neutral
and hand made by dan  jenn sock blockers  made from exotic woods  one of which is called purple heart,neutral
 yay about breaking 200,positive
 bahah sadly i am not,negative
 i always have those for my champions league parties  tis awesome,positive
 well not all just stay away from those kinds and surround yourself with those who dont happy mothers day to ur mom treiz,positive
_adel they didnt reply yet wait till they confirm in case somebody might have translated it already,neutral
 thats rough hubby had knee surgery but it did help him in the end let us know the results well keep him in our prayers,negative
might have to go back much earlier than expected bye bye bay area,neutral
playin city of villains wishin my buddies were playin with me,positive
 yep  three things a good haircut the ability to listen and the value of not taking yourself too seriously,positive
 riley hacked my twitter  hahaha ,neutral
big sad face   bing doesnt work on iphone  it just takes you to the regular mobile live search,neutral
 i liked it  did you record it yourself  if so you have a very soothing voice,positive
man im so sad school is ending  but then again high school might be better o,neutral
 folks thought it was hilarious when i told them the story and then they saw the shirt i wore tonight  laughter all night,positive
 youre the absoute best,positive
oh my god i cried so much watch this guys from bgt  httpbitly5t5xz,neutral
my near daily exercise is starting to show results,neutral
 welcome,positive
bout to hit pmark then make one of my final meals wit the housemates,neutral
 you get to go home and i have to go to work,neutral
voted for  on cmtcom,neutral
just got home from a nice party just not tired yet,positive
now i have a sunburn,negative
i have the job  this is a nice day it can not be better,positive
i wish i could go to bea this weekend,positive
i 3 rupert grint of the boy ive accepted tht i do fancy him  but im certain he doesnt feel the same so its not worth telling him,neutral
 love your books,positive
ok so this eye doctor guy is taking forever and im sitting in a cold room by myselfwhat a jerk,negative
im slowing on my tweetscuase i lost my phone,negative
 well thank your phone for me,positive
 why would they take a photo with stuffed animals thats pretty funny,positive
tweetdeck is acting really strange hum reinstall maybe update on the horizon or is it just another adobe memory leak,neutral
tikcets are only ãââ½91eachbut i so want to go,positive
 happy mothers day,positive
 its gonna be hot here today too today is ryans last day of prek i cant believe it  ive been a sahm since i had him,negative
is dreaming of the weekend awake,neutral
oh  me ive just returned from the supermarket of doom to find that i have nothing to drink here,negative
 yay but you missed naptime,neutral
dgroup saturdays with a little bit of football an hour nap 3 hours of soccer basketball in the tsu and yogurtland lifes good,positive
just set up a new computer again 15min i love norton ghost,positive
ahhh my mommie got me new sheets for my bed  so comfy,positive
_celeste  finally some sleep in silence,neutral
im just up  and its 1243 o  im so lazy thank god its a bank holiday,neutral
is pretty dang tired but chambers class is for napping,negative
i have to poop   is hogging the shitter,negative
yes im down to 50 full on my dvr  i was at 98 like 3 days ago lol i swear if i didnt have a dvr i would never watch tv,neutral
happy muthaths day to all moms i salute you,positive
hahaha alright  ,positive
 arent you suppossed to support the local economy  lol  good for you and congrats,positive
 good to know   thanks,positive
 what are you flavor of the day,neutral
weathers let me down this morningughhada gd nite tho,neutral
just listened to condre scr and got an invitation to watch their live concert on june 20th in munich httpbitlydaxa0  postrock,neutral
 elo  wow brings back so many happy memories  love this bandand yes i know im showing my age but i dont care,positive
 thats a very cute picture  but you dont get fat from licking bbqs  he must have found some chops on someone elses ,positive
 oh i love sunday mornings like this  mum just made scrambled eggs on toast,positive
hate working when its sunnyboohoo,negative
is online  httpplurkcompstjdg,neutral
bundy in 3 days warm weather here i come,neutral
wondering if i cld make things any worse than they already are answer just did,negative
a dutch marketing agency is asking job applicants to apply in 140 characters or less  httpwwwenergizenltwillicitatie,neutral
twitter has spoiled all the fun frustratingly slow  couldnt even bid properly,negative
_chick haha i completely agree,positive
if we dont pack she cant leave right,neutral
   lolwhere u headed to,neutral
going to bed after a great night with a friend  glad to know she has the same feelings about classes as someone else,positive
 many mine included ahem shld have known better back then wldnt have missed so many opportunities haha,negative
its nice to leave the office when the sun is still up,positive
i will miss the soccer moms,negative
 between the garlic pills the spider bite between your toe lolclassic and you always being hungry u are killing me 2 funny,neutral
 sighs ah well  maybe my second email will clear it up and get him approved,neutral
  missed all your tweets again joe  that time difference uk dont 4get about your fave supporters in the uk  ,neutral
 that came to my mind so i said it and it has now been adapted into my familys vocabulary,neutral
looking forward to body works today,neutral
just watched yes man bahaha that movie is messed up,negative
 sadly i think i know exactly were you put itin the expired drawer   those things have a life span of less than two years,negative
 too much no not unless one of the pillows ends up suffocating the one sleeping next to you,negative
meeting my best friend first thing in the morning to the gym omg i am still so shocked i hope you will get better soon,neutral
wow that was fastnext up soderling or ferrer gilles simon lost,negative
 yup theory is great but the reality is beyond imagination  i also made the same planning not knowing vs will fail on me,neutral
 glad to know that the ad display problem was due to a firewall config at yr office phew,positive
 woot,positive
i dont like monday i wish it were sunday cause thats my fun day  that was my freaking jam when i was little   i miss it,neutral
       httpbitlynack2,neutral
waiting for the last movie to finish then am test screening ghost of girlfriends past glass of wine and lolly bag in hand yay,neutral
happy starwarsday may the 4th be with you  from everyone _paintball,positive
must head back to the office,neutral
st joe is dirty,negative
httptwitpiccom4w67k  camping at black butte lake,neutral
 are you getting my messages or do you have to add me to recieve them soz im new to this,neutral
i hate my life,negative
sick to my stomach and i have a headache i wish someone could come rub my temples,negative
  natalya you gotta tell me whats going on id call you but i lost all my phone numbers when i broke my blackberry,negative
just thought about how unfair 3 ppl have been 2 me n got depressed again  haters,negative
crying real tears,negative
_brown been holding onto this one for a while  httptwitpiccom4w5eh,neutral
 panchitos burfday party tonight wish you were here kiddo,positive
back from town and my mac crashed on me  but its better now,neutral
archie andrews what were you thinking veronica,neutral
the best things in life are free  x,positive
misses my mom today she was my best friend and even though she has been gone several yrs i still miss her dearly happy mothers day,positive
i am watching blood  on veoh episode 19 love the musicwishing i could watch the live action but not old enough,negative
 that is a bummer,negative
 he is the truth but what about maxwell you cant forget the future father of my children,neutral
httptwitpiccom665jw the racoons ate our bread,negative
be sure to let the moms you know how fabulous you think they are   almost mothers day,positive
_in_a_story glad im not the only one hes our baby and im terrified hell think were never coming back,neutral
no launch today teacher changed plans and we watched a stupid move about tesla,negative
  its very pleasant i sooo rarely just have time to kill,positive
 thank you ooh i see youve read desert islands httpisgdys6k great book,positive
__o lol but tiz a good song,positive
again working on the internet shop  dont think we will achieve the goal of uploading by the previously set time   will keep going,neutral
_anix_ i bought cheesecake ice cream last week thinking it was good and it sucked so much   im taking yours,negative
 what causes the frustration buddy,neutral
_wright thank you return of the mack is the jam,positive
ready for this saddenning depressing dullful upsetting dreadful weekend,negative
sorry for my lack of tweets  ive been buzy new vid this saturday,negative
 i do my humble best  going on a works paintball day soon so that should fuel a few strips no doubt,positive
going to bed  cant take thiss any longeerr maan u,negative
_morden be at richards if not then ill see you when youwe get back  good luck,positive
 thanksi really do appreciate that i know it will be the hardest thing i have ever done,neutral
spent the last hour signing yearbooks ill miss you guys,negative
and i just love every little thing about you,positive
my mobile has stopped recieving text messages again stoooopid thing,negative
 hi simon let me know when its done,neutral
had an amazing night with my favorite lady friend,positive
_oyler poor little woman with her smushed in head,negative
is fixin to clean the house for my mom for mothers day,positive
why do you think people say save the drama fo yo mama im sure even yo mama wouldnt wanna listen to ur drama ode to mothers day,neutral
 hey thats my school i hate that place,negative
 i did i only got 3 stars on the pre wash then failed the rince,negative
my sister in law just left for her prom she looked soo pretty tears all around,positive
 follow me too,neutral
bought three books yipee  now whos with me on that readtenbooksduringthesummer thing,neutral
im really bored my brother went to get his permit stay off the roads jk lol it feels like all my friends have abandoned me except 1,negative
 goodnight,positive
_the_moon hiya hun its just not my day dentist appointment ouchnotebook being a  feeling sick  hows you,negative
 but i do emily ahahha you scare me so it would work,negative
now i need to change my monitor,neutral
 i know dude im doing reruns making jenny watch them now too so we can have conversations lol  havent been online much,neutral
what about me   i vote every day for you ,neutral
should not have waled past the quad i want to be outside having fun,positive
just rocked home from maccas and now signing a petition for big bang to tour aus  lol,neutral
i think the food i ate made me sick i no feel so good,negative
 eagerly anticipating twitpics,neutral
lots of tasks to complete today first wecloming new members to canadamigos social networking site wwwcanadamigoscom and coffee,positive
just wants to stay in bed all day but has to go to work instead  sux,negative
chillen trying to figure this thing out gettin drunk,positive
yay doctors  now interview then back 2 the doctors for blood work,neutral
filming at a carnival for my music video it reminds me of the cherry festival that i used to go to back home ahhh memories,positive
im siiiiiickkk  i dun feel good,negative
 propellerheads has been on my harddrive for a long while just got my music repo back in shape this we and felt nostalgic,positive
glorious sunny day in london town im in drama school fighting people with swords while protecting my romantically structured face,positive
_89 i feel so sorry for her  hope she dnt cry 2nd time,negative
would wish the severe migrains would stop docs prescriptions arent working,negative
0909 full moon my lovely friends and family my bday wish came true3 in additiongray matters is one of the cutest movies ever,positive
my life would suck without you  kelly clarkson,negative
revising for exams,neutral
 you should so host the next logies i only laughed at your bit really,positive
 hi jordan im gonna all of ui know ur busy and i know ur probably tired but please reschedule nc dont leave us out,neutral
__joy i feel like red lea now,positive
 id love to but i think the trek from london would be a bit too much,neutral
 hey hey,neutral
thinks revising in the garden from 8 this morning without sunscreen isnt the best idea ive had  oucccccccch,negative
is miserable  i feel like im gona cry  sux,negative
 i know they are deliciousmiss germany but like holland as well as we used to shoppin there at weekendslol,positive
 lol very true maybe next year i loooved that siggy and i dont remember what the password for the mod thing was  cake,positive
 lol get watching it again  hehe,neutral
 hope you did great  you certainly spent enough time studying,positive
 btw  downloaded iphone 30 sdk,neutral
straighening my hair and its not going as straight as i want it to be what a  bummerrr for me,negative
 i need botox work on the lips if im going to change my name to angelina jolie but its a thought sad though about the racism,negative
 me a doctor laughs oh no no no i was _cranes patient at arkham aslyum but now i work for him,neutral
morning all have a great day off to school i go,positive
now in a weird mood  muahaz,negative
 congrats photo of dre,positive
sanctuarysunday  thanks for joining on sanctuarysunday follow more sanctuary people to keep up to date on the tweets,positive
done at disneyland kids knocked out stopped by the hotel bar and grabbed a grey goose  tonic on the way uppeace,positive
 ok lol i miss you too i hope your cramps get better i know how painful they can be,neutral
 oh and a very good review,positive
_mileycyrus it wont let me do it twitter keeps saying over twitter capacity or something that bird keeps coming up,negative
im extremely hungry and the only thing i have in my house is soup  i dont like soup pouts,negative
 its hilarious,positive
 i love the guy that was standing behind me,positive
bout to hit the sackgot  to do tomorrow happy mothers day mom,positive
lost my dc hat ,negative
starting the video editing of the first spanking movie we did with mina  it will be added to the next update,neutral
   in effect your podcast is the audio version of your book isn plus it has the added charm of banter  ,neutral
sunny synday morning nicole is up later than usual mommy got some sleep,neutral
browsing  find everything about university  interior design,neutral
i have not tweeted for sixteen days i miss it  ive been having fun though d ingrid on mon was frakking awesome  bbq today,neutral
 visit si fr joemar dito bataan frm camiguin  sum of my ofcmates i are supposed to meet him this saturday  cant luwas,neutral
 i am soo excited about your pasadena seminarif only i can find the confermation email,positive
ugh i dont feel well again all of a sudden,negative
i want a new phone  ive seen too much cellphone commercials ,negative
 well test that theory  with no right arm to strum with  got a feelin ill be humming my new tunes for a while,negative
 httptwitpiccom4vuuy  thats so cool,positive
school 39 days  so exited amazing premier ,positive
  tis very useful indeed esp for newbies like me,positive
gonna go and see my sister at mount sinai   shes there for at least another 24 hours,neutral
 it was just the handle tg,neutral
backe backe muffins,neutral
is relaxing after working on mothers day  oh well a good day had  hope you are all well,positive
lasttt mondayyy of classs,neutral
 yup  now i can join in on the nin access fun,positive
i just walked into work all the while thinking that i was sitting in bellagio this time wednesday,neutral
 unfair  i wanna go too,negative
download movie  a good day to be black 38 sexy httptinyurlcomckmkul cool movie,positive
jus got back from a run up sunset blvd my cuzin tried to kill me my legs are still movin and im sittin down,negative
 aww thats sad  i miss seeing you guys on the big screen,negative
 i knooww   my hot water bottle iss in whangamata without me ahhhhh,neutral
 eeeeep so jealous  im at work  um how can u receive viva do they broadcast it online plz,negative
 thank you so much phaoloo ,positive
 the hotel should be thankful,positive
watching gh i feel so bad for carly  omg so  up,negative
 rofl thats what we like to hear,positive
ok im frustrated there is hella dust between the screens of my blackberry,negative
is anyone awake oh my god i am dying here i want to go to sleeeeeeeeeeeeeeeeeeeeeeeeeeeeeeeeeeeeeeeeeeeeeeeeeeeeeeeeeeep ,negative
 we do its been to long i think i have next weekend open when are you going to have the house warming party,neutral
change of plans working inside bar tonight,neutral
 thanks for following,positive
 well good luck then,positive
at work getting a quick bite to eat before having to kill my wrist self addressing 500 envolopes,negative
arghhhhhhhhh i cant keep up with these twitterbones peeps,negative
undervote is just going on  im all overalled up,neutral
making german apple slice  nom nom nom,positive
looks like its another night at the office lol,neutral
my tummy hurts,negative
got about 2 hours sleep,neutral
anybody else experiencing painful slowdowns with facebook,negative
lol2 people in falconand boo one of them being becca,neutral
i really need to earn money so that i can watch the pcd concert,neutral
the poor pirate had out his last wisdom tooth and is looking really peaky,negative
mozzer cancelled tonight by the looks of it,positive
waiting for aaron to get into town and then leave him for work booo,negative
morning tweat tweat twitter,neutral
headed home  charlies at the vet,neutral
i wanna b maliks from taking the stage,neutral
